id,tweet,ES
736,sebenernya Mon maap ya ini otak jadi merecall kejadian itu auto ngakak Merasa kecewa sama diri sendiri karena kemarin childdish ngambek ke orang ini wkwk Terima kasih athiiii yukyuk kita agendakan Manusia di kampus gue lucu lucu ternyata Umm Okay Gue ga pernah tau kalo gue boleh merasakan bahagia karena dikelilingi orang orang baik Nangis sejadi jadinya baca ucapan dari mereka yg gue sayang Pagi nanti mata gue auto bengep Anyway selamat ulang tahun Meilan Happy birthday kembaran beda bertahun,2
737,ada ada aja masalah D dl qt dah prnh pk owh v thanks you saranny mohon maaf lahir bathin amp slmt lebarannn fadhillll baik2 fr nnt ditriakin Thousands of people across the country are celebrating the end of Ramadan by marching on the streets defying orders by the HAHAHAHAHAHAHAHAHAHAHAH gasabar punya ponakan bikin plis n kaya dito eh btw mohon maaf lahir bathin guysssss amp selamat hari raya idul fitri pusing bgt semua pengen ngobrol group call keluarga berdatangan It,2
738,negara ini tuh kenapa ya i apologize if i ever was a toxic person in your life if i did u wrong acted on impulse let my emotions have control Sungkem sama Nenek aku aja keluar ruang ujian langsung amnesia Bagus Daripada yang satunya mending ini Daritadi minta link apa bedanya hyung Makanya beli yg asli unnie Kui dalan bedo ayo nyobo kono neh wkwk Kok kacian sekali Aku pernah takut sama salah satu dosen smpe ketemu beliau sungkan ae,2
739,nyaman deng Ratu Kidul aq yang pasti pasti aja hati Firasah Saat rombongan ratu kidul dihadang Imam Suyudono beradu kekuatan seperti kewalahan beliau panggil Imam Aq nya datang mau menombak trisula besar emas pusaka Beradu ilmu Aq iyaA Ratu Kidul Ratu Kidul belok haluan Mau jelma jadi manusia hati Iyaa kemarin lihat saat makan Siomay kan habis terawih rukuh di rumah pernik hijau hati hayoongaku Firasah Ratu Kidul bawa mahkota batu warna merah mirip merah delima bersama kereta perang bersama,1
740,lennon ni Oh gt y gpduli sih Oh gt g bgitu pduli si km ccok sbgai beban kluarga Kaku amat kaya uciha sasuke Lbih baik diam ka dripada mnganut yg slah Hmmm dulu udah dipanggang mau dipanggang lagi keknya Army gada obat kak emg juara 1 melanggar perintah tuhan Ekspresi lo waktu liat kelakuan beauty vlogger dan warga 62 sejenis lainnya indonesiaterserah Ah ah ah ahhhhh ah mas banting kanan mas ahhhhhh aku minggirin mtor sbntar ya yang lu yg,2
741,makes you happy wkwkwkwk pengen butter cookies pas dibuka rengginang wkwkwk koceng salto tinggal eres eresan itu mah tik makan nastar ajaaa ada tuh ketupat sama lonsay tapi udah gak nampung nad aku cuma mikir kalo ujan kasian partyplannernya udah cape cape cita cita kurus realita sarapan pake empal resep keluarga terenak nasinya nambah lagi selamat hari raya idul fitri rie mohon maaf lahir batin ya memaklumi orang orang kurang pendidikan sampai kapan memaklumi pendidikan emang penting kalau rezeki banyak,1
742,Mei 2020 6 Pastikan akun kamu tidak dikunci 7 1 Pemenang berhak 1 Follow Twitter amp 2 Retweet dan likes seluruh postingan ini 3 Inget jawab pake ha GIVEAWAY ALE Perut udah kenyang rebahan lagi santai scrolling scrolling Twitter mending ikutan giveaway Unt Terus habis minum kopi mata on terus Jeng jeng Bangunan yang berdiri sejak 1 400 tahun ini telah beberapa kali berganti fungsi mulai gereja masjid hingga museum kumpar share link aja biar dibantu report sama yang lain,1
743,When your girlfriend wakes up before you shibainu gaku IG tenang nder nanti lu punya jg Tp jgn dipamerin kaya gitu ya Gbgs Gue pernah diposisi sahabat lo nder Ya jengkelah dia denger curhatan lo disakitin mulu giliran dikasih sara asli kesel bgt kalo nilai org yg nyontek ke lu JAUH lebih bagus drpd nilai lu Sebenernya lebih ke kenapa gitu banyak orang yang semangat banget ngejelek jelekin dia Ya walaupun dia emang s Saya mendengar berita tentang warga satu,2
744,hangatnya seketika ia lenyap seenaknya maafnya diterima tapi untuk kembali bersama tidak bisa tak banyak berimajinasi bahkan sedikit berinteraksi namun rindu masih saling memiliki aku dan dia masih ada walau tanpa sapa yang sebelumnya saling memberi cinta kini memaksa melupa atas segala hal yang terhubung semoga tidak ada kata rampung air mata masih menjadi teman paling setia yang selalu hadir belum tentu menjadi takdir sempat mencintai seseorang tanpa jeda hingga tak sadar ditinggalkan tanpa kata wahai jiwa jiwa yang tersesat,2
745,tidak suka sama kebijakan banjir dan efek kejut dll nya Heran yang milih dia siapa dah disaat rakyat lagi berjuang ngelawan virus corona berusaha untuk social distancing wakil rakyatnya malah begini Mengingat di Indonesia kesadaran akan donor darah rutin per 3 bulan sekalinya masih rendah di banding negara lain ditambah masalah covid 19 yg bikin orang takut buat ikutan donor darah maka semakin menipis persediaan darah di pmi sekarang Sedih denger berita persediaan darah di seluruh pmi menipis gimana nasib,2
746,lu cerminan gue Apa yg lu lakuin apa yg lu tunjukin ke gue pasti bisa gue lakuin juga Skrg terbukti kan Intinya jgn cari gue apalagi coba2 inget gue pas lu lagi susah dan terpuruk lagi ya Buat coba mikirin aja lu gak gue izinin Maaf lu udah bukan lagi salah satu alesan gue harus senyum Senyum gue udh gak pantes dikasih ke lu Quarantine day 17363383 Diliat dari style nya aja aku sudah mengenalinya hmm isi dong buat seru,2
747,ini tegas sm diri sendiri Could listen to and SLVR all day via EDM People Youtube AKHIRNYA GORDON RAMSAY UNCHARTED KE INDO DAN NORWAY HAHAHA Everything that we ve been waiting for Gordon Ramsay x Masakan Padang Start Season 7 Juni Estimasi episode Sumatra 2 me after expressing any kind of vulnerability with someone Kita sudah memasuki Black Mirror Season 6 t co Qz4TLeowo0 I ll start He stood me up then I was extremely upset and hurt because he,1
748,safiraasfr Mksdnya OIII SUKAAA BANGET ASTAGHFIRULLAH NGEFENS DONG GIMANA INIIII Kalo pake tangan gasukaaa Siapa yang punya Kadang cakep kadang gak juga hul hahaha Aku kalo lipstik warnaa nya pada mirip2 semua hul merk aja beda beda hahaa Aku juga bingung kalo milih warna beda bibir beda lg warnanya kan Unchhh cakepku Itu campur hehhe baby bright coco sama implora no 1 hueuee I don t have a photographer Lebaran vibe ft anak anak krucil Haha gaskan Maaf lahir bathin,2
749,mau pagi pagi panas panas resiko tinggi mau ngantri di halte TJ min Reminder Seakrab dan sedeket apapun kita sama temen sebaiknya jangan terlalu percaya dan terlalu berharap lebih sama merek hidup kok gini amat dah otak selalu aja cemas takut kalau hidup bakal gini gini terus takut masa depan gajelas takut gak kadang klo lagi cape pengen bgt nangis tapi gabisa sedangkan lagi diem2 bae tiba2 nangis entah kenapa i wrote a song i think i wrote another song,4
750,ntar gabisa liat adek lg Wow it s still fresh twice faster than EfficientDett hmmm hohoo benar juga ssuk golek gunung se ono lift e Kan jadi bingung kan Well belajar hukum waris Islam yg baik n bener it penting Yahh paling gak saya pernah belajar dulu walaupun cmn sedikit Dari 6 tahun yg lalu gue udah beberapa kali bahas perjanjian pranikah seperti pisah harta Eh ada aja yg bilang mau nika Jubah tak terlihat deathly hollows Ati digoleki kematian,2
751,wkwk Gak dapet kepala otomatis tidak dapet ekor juga hadeh Aw aw capaneh besok hari kemenangan tapi hati kok blm menang si mbak gimana Sedang di masa semester tua tapi malah temen yg ga deket jadi deket temen yg deket makin deket Karena walaupun jalan sendiri2 tapi mereka masi punya empati dan saling nyemangatin satu sama lain Percaya lah nder punya temen ga seburuk itu kok Di luar negri udah pada mulai pulih pelan pelan karena warganya taat sama peraturan,2
752,gaes Umy Semangat suyung Ada yg bisa bantuin aku buat cek di aku ini milia atau bukan gak Nanti fotonya ku DM Abisnya aku bingung gaes Jebul sendal teplek kesayanganku nyoplok gaes karena sering keujanan kalo main Huhu Aku fokus karo jalane wkwk Dasar kompor lu wkwk Aku nangarep ya Gak kaki kanan atau kiri pada abuh kena standar motor Iya asik Kapan Gak mau baca status bilang lebaran dg dipisah jadi lebar an Padahal yg bikin kurus I think,2
753,order imposed by the very thing you claim to worship that is truth Homunculus Edward lama lama kaya Naruto nih musuh diceramahin luluh aja lagi ga idealis banget ya kalo mau jahat mah jahat aja knp tanggung The truth can be such a cruel thing Homunculus wkkwkw 7 deadly sins yang asli jadi inspirasi untuk anime Bradley ga ada matinya l A l F m n l n w l z n L semuanyaaa iyaa bener Can itu 7 deadly,3
754,aku pura2 ajalah ampe sobian ama preman cipulir masa belom layak dapet gelar bascil wkwk apa itu bascil guncangan sudah bergerak ke garis selatan stay safe everyone aku bintaro bener2 solid ni duo yak tolong ya tolong kalian warga ciledug dikit lagi ditatar ama anak Depok amp Bekasi turun harga diriku di matanya sbg warga ciledug jadi gini rasanya jadi orang Depok Bekasi yg suka diolok olok warga jan bilang2 ya kalo aku yg ngadu ya dahsyat kalo yg kena,3
755,bilang lebih seru iyaa yg ini bukan yg ss yg kotak kecil itu di bawah fotonya tu hidden replies nya lebi seru wkwk My plans 2020 akhirnyaaaa nemu jg judulnya sama setelah setaun lebih gakepikiran pengen trs skrg tb2 pengen beli album sm merch jg we back to the start 9 year old me packing my bag to run away from home after my mom yelled at me My parents are not rich But I ve never not had food,3
756,doesnt make him stay a pretty face doesnt make him stay loving him harder isnt going to make him stay either do you k Kami berinisiatif bertanya ke pengacara cara merespons penjemputan mendadak aparat butuh tidur yaAllah Ini alasan lu follow gua jak Ngakak juga liatin spekulan masker sama sanitizer rugi abis2an Klo mau gorok cuan gede2an pastiin barang yg lu jual ga Masih gua liatin Anjir dah rata rata anak muda loh pikirannya dikemanain sampe kaya gitu Nanya mulu,2
757,mencoba tp tdk ada nyali wkwk Dah ah capek Hahahah bangsat Melu2 huu Janeeyy pntesan ga keliatan di tl ak Aku Me reading everybody s text from the notifications bar and ignoring it because i am busy doing nothing Jadi ak ngejahit sarung gitu dikasih karet biar praktis tp jdnya kek rok rempel anj nangis bgt Ekspektasi gak bisa move on dari masa lalu bukan berarti ngorbanin orang baru Introvert itu bukan Nggak keluar rumah Pendiam Ga suka bicara depan,1
758,Selama nganggur ga pernah nyentuh dompet lg skrg dompetnya ilang gatau keselip dimana Ya ampun sampai dicekin makasih banyak yaa aku selama ini nggak mencet prodinya wkwk makanya ga tau Iyaa hehe aku gak mencet itu selama ini Makasih mas Gk nyambung Oohh pantesan aku gak nekan prodinya selama ini Makasih banyak yaaa Gk jd gue maafin karena kok bajunya dimasukin Btw makasih yaa hara Nyari yg 2018 di bagian mana ya Aku nemu yang tahun 2019 aja soalnya btw,3
759,hasil semalam agak mengejutkan Time for a thread on the USSR since some on the left seem to have a soft spot for the communist regime Here s why any sane p Financial Fair play Auk tadi stella manggil Pace dipanggil People taking this poll seriously And they say that Ederson is the goalie with the best feet Dulu terkenal cis cuman udah bubar So this is how chickens lay eggs Hendo AskTrent PJ Tucker at center trying to guard,1
760,Anyway siapkan dana darurat gaes Keliatannya sepele tapi begitu ada apa apa kayak kehilangan kerjaan mendadak atau sak Kerumunan di McD Sarinah semalam mungkin akan menyakiti perasaan orang2 yang sudah rela potong gaji sampai dirumahkan tanpa d Tuhkann pyy lama2 bertelorr wkwk Nahh inii mau seberapa lama gue dirumah pun kalo masih banyak orang lain yang masih anggap remeh jadinya ya percuma aja gue begini Malah bisa jadi di extend nih dirumahajanya Please lah kerjasamanya semuaa biar kita gak lama2,2
761,srnndy Wa ya Kalau dikasih mah ga nolak wkwkw Cowo emg gitu Suka ngilang wkwkw Gua kagak dikasih Awal2 pandemi banyak yg tereak2 kesusahan buat makan aja katanya gada Skrg orang2 pada lari ke Mall pasar buat beli baju le Bukan bikin konten untuk menaikan popularitas lu lalu nyesel terus minta maaf Lama2 Indonesia org2nya juga bukan ga punya otak tapi ga punya akhlak Mungkin kecewa thd pemerintah karena ga jelas aturan PSBB dan org2 Indonesia susah diatur Daripada bikin,2
762,semoga allah menempatkan mereka disisi Nya Aamiin Gedeg aja dun kek gampang bgt netizen dicuci otak sm kek gitu Ini kenapa pada yakin indonesia nerapin herd immunity sih Kaga begoo ini emang kelakuan rakyat bejad aja sama pemerinta kurang responsif sama covid 19 Hadeh pengalihan isu Asu kapan nih beli bang jo lg wkwk hi sahabat bang jo Kangen sm bangjooo wkk Gaskeun Corona telah mengubah banyak hal kecuali bacot netizen Ngoceh2 pemerintah gak bener Kelakuan rakyat aja begini Gaada,2
763,Gw katolik ibu kos muslim Natalan kmrin si ibu aku kirim hampers Pagi ini mo misa online si ibu bawain makan lengkap dgn Kenapa Manusia biasanya kalo habis tumpahin makanan gitu pasti buru buru diberesin Kalo kera ya pasti ketawa ke tanya2rl Halo yg suka jbjb ayo mutualan wkwk ntar jangan lupa follback okeee aku cwo Broken home cant relate Ch jw paan Cina jawa Produk snail2an Exfoliation alias pengelupasan kulit nder Nah produk skincare dibagi dua untuk exfoliation physical,1
764,thread yarr semoga galaku ya mba biar dipake seumur hidup buat nutupin sifat serakahnya pidio lu yg kek gni dah diapus ya nal masih tad bru mau ngangetin nasi karena cinta tak selamanya indah tkut kiamat waktu kekk cpet bgtt kasi tau apee ngompor aje begadang mlu ram pap nal urrrr saurrr,1
765,trus komennya pada kenapasi wkwkwkwkw,4
766,Masih aku liatin Tiba tiba jadi inget guru jaman SD kalau misuh suka ngomong oalah gusti paringo mercy Aamiin ya Allah A Kuning KuisAlfamart next list Tak usah gundah lebaran ini hanya DirumahAja karena KuisAlfamart 25 Mei 2020 akan selalu temani hari hari mu Sahabat Yuk Sampaikan Ucapan Lebaran Lewat Stiker WhatsApp Ini Caranya stikerwhatsapp whatsapp t co HczeiDlwR9 lewat Blender Turbo nomer 1 QuizIdaman CariTHRTurbo ekabyan yuk ikutan jawab juga Untuk menemani aktifitas Teman Idaman yg lagi merayakan Lebaran,1
767,beberapa teori mengenai awan di dalam budaya Hasil panen pertama Bantu siram tanamanku yuk Ayo panen buah di Shopee biar dapat produk gratis Beberapa film dari Hayao Miyazaki Masterful Storyteller The Walt Disney of Japan Co founder studio ghibli Soundtrack GIVEAWAY PULSA TSEL 1JT BUAT 10 ORANG MASING2 100RB caranya cukup twit ini sama follow gua aja reply apaan aja te Benar benar kecewa sama negara sendiri Seandainya untilltomorrow posting Ajakan untuk social distancing di tengah wabah covid 19 ajakan,2
768,Semenjak download tiqtoq aku jarang buka wa twitter bahkan ig Apa ada yang sama kayak aku juga Keyword untuk menemukan gifs aesthetic dan uwu a thread Aku juga begitu trus si doi ujung2 nya ngambek deh one person followed me and one person unfollowed me automatically checked by Kira kira kalau udh di nikahin masi ada pelakor ga mbak Tag ga nih wkwk Punya tp seperti tidak punya terkadang one person followed me automatically checked by Mirip temen gue sumpah,1
769,LIBURAN MSH LAMA KAN tapi ntar dibilang tidak memanusiakan manusia ga guna si ngoceh disini gabakal diem juga mereka apa langsung siram air aja kali ya kepada makhluk2 di depan pagar rumah ibu bapak saya BISA GA BUBAR MAINNYA INGET JAM BUSET DAH MAU TIDUR INI NIH Marv Didikan makhluk bumi Ama makhluk asgard jelas beda w0w gercep ugha emg harga kaca mahal ya dokter keren dah bisa berjam2 ngeliat ginian AHHAHAHAHAHHAHAHA NGAKAKKK qiwww cerita dong qq oneng sayang bgt,2
770,Hijriyah Terimakasih sudah diingatkan Nuzulul Qur an dan Haul Ahlul Badr Malam 17 Ramadhan 1441 H Malam Ini malam nuzulul Qur an malam badr malam dimana Misiii Mau ngingatin aja kalau malam ini malam Nuzulul Qur an ya Allah gemoi bgt ga kuad Suka bingung kalo ditanya mau dibeliin apa soalnya banyak banget yang bisa disebut Asking kalo kalian punya pengalaman tentang intel ga Kenalan ato pernah tau gitu atau mungkin kalian sendiri wkwk Kalau terus mencari yang lebih baik,2
771,episode sebelumnya tai bat ketawanya Gini nih kalo bapak2 dikumpulin cape bat gue ketawa Waktu masih sendiri kamu tinggalkan sendiri Waktu udah berdua kamu suruh mendua Waktu masih ada kamu enggak pernah a Everyone can actually cook its just a matter of putting extra effort Imam Al Ghazali benar Orang yang jatuh cinta tidak pernah merasa tenang kecuali bersama kekasihnya Beruntung bagi,2
772,sih pernah kayanya Apakah anda pernah merasakan mas Makanya itu tapi dilihat rekam jejak dari tahun2 sblmnya memang ini sebuah prestasi Makan indomi antum bilang ga sengaja Jenis jenis tanaman yg cocok untuk dekorasi ruangan Image cr ig Tar jg turun 2 cylinder wkwkwk Pengen motor2an Satu kali kesana dan meninggalkan cerita Diketawain pe sm proplayer wkwkw Itu saha dit Hehe Lagi throw in pe wkwkwk Lekas pulih Apedah nih baru bgt puasa udh baca ginian pagi2 wkwkwk Jadi gini,0
773,tapi tetep kangen keluarga besar soedirja sm masiran huhu happy fam happy me Eid mubarak semuanya Ramadan kali ini campur aduk bgt rasanya Nikmat bahagia lelah sedih jd satu paket berharga yang ak blg aja emg maunya beli jadi he he luv kalo abis buka linkedin tuh insecure bgt deh liat orang orang pd hebat bgt pencapaiannya gue tuh ngga gampang ilfeel sm org tp sekalinya ilfeel kyk bzjsnsjwiwn bayanginnya aja males gue ga si Lama lama cara ngadepin corona,3
774,timun suri Sekarang pemandangan nya tembok berlin Kangen suasana sawah di depan rumah Berada di ruang kosong dan belum menemukan pintu keluar Apapun trending nya pasti disitu ada foto betina mutualan open vcs alias sebel banget wkwk Tidak ada kebetulan dalam sebuah takdir Gapapa doyan bikin juga doi wkwk Hepibidayyy mba nadakuuu yg blaem blaem Bener ugaaa Cape banget abis ngabuburit dari kamar ke dapur Ada pesantren kilat ga ya ramadhan tahun ini Ga nyangka besok udah puasa mikirin besok,3
775,BANGCAD namanya Rizal biasa kalo d kampung di pnggil mommo semngatny membantu org tuany berjualan gorengan sangat luar biasa IndiraKhalista DENGER TOLONG DPO12 Sombong Masa gua diem Tapi gagini cara mainnya mba Why asking Tau tapi pura pura bego Capricorn Aquarius Taurus Pisces Cancer Virgo Ga tau tapi ga Cerita hidup Untung cuma pengen emosi ga pengen balikan yakan berbagai resep amp tips masak dari Caca a thread Muleh muleh enter wind ngko lek kesuen Masalahe saiki lek arep sweet,2
776,ogah2an di jalan padahalkan kuliah kaya komitmen gitu Udah gitu beliau jg gatau ttg kuliah kuliahan yowes dadine sekarepku kabeh Kalo di kampus lo ada her reg sebelum pergantian di tiap semester kayanya nama lo otomatis bakal keapus di semester selanjutnya CMIIW Such a randomly thought sehabis kulon gue gini amat Lalu teringat SHINee bakal debut anniversary Kepikiran Sungjin sama Brian bakal wamil Hnggg Sama dan kayanya gak akan pernah alias gue mahasiswa paketan Coba otodidak aja di sololearn Gue,2
777,usaha bukan membalas rasa Surabaya 19 Mei 2017 Karepmu lah sa endonesa Alhamdulillah keturutan bakso mangun Suara pintunya tiap liat lemari dalem hati bilang duh pake baju apa ya ngga punya baju gini itu lemari kalo bisa ngomong pasti bilang Susahnya husnuzon apa sih Luuur t co Ut6VfwCiPo GusBaha SantriGayeng udahlah Iklan indomie 2007 entah kenapa kalo liat iklan iklan dulu tuh suka sedih Pengen ngembaliin jam tidur sebelum wfh yg kalo jam 9 10 udah ngantuk bgt SweetHome Drama,2
778,itu tempat hang out SMP Jangan pacaran di jogja romantisnya kelewatan Kalo patah hati kenangannya tak akan terlupakan Sedih ya kak padahal seharusnya keluarga adalah our safest place untuk mengadu soal apapun tapi banyak keja miris sih saat anak udah percaya sepenuhnya sama keluarga sampe berani mengakui hal yg katanya aib di mas LathiChallenge Follow me on Instagram for more tutorials like this kyk kenal HAHHAHAHA SPESIALIS IYAA ANJER pada mo belanja apaan sih sebagai warga ciledug yg suka rebahan,4
779,bro gua memang selalu tersakiti I enjoy the cringey moment cis kocak gara2 cringenya maksud gua Too hot to handle kocak bgt dah HAHAHAH Haaland I think i do hmm This energy right here gt gt At last Goodluckk dir this girl on tiktok just bodied wes anderson in one minute Oiya ya sekarang lagi skripsian ya Coba nonton yu yu hakusho Kalo ga salah yang buat hxh sama kayak yang buat yu yu hakusho Tempat tempat di Jakarta yang,1
780,no Wahh okedehh makasi myaw jd pengen nyoba nih wkwk Kayaknya S2 tuh enak Tapi Kerja juga enak Hoalah gituu bisa ditepungin jg yaa Tp klo nyari bumbu bubuk keju ato bbq nya gt dimana yak kira2 Kamu pake makaroni biasa yg buat sop itu kah myaw Nahh iya bercandaan bapak2 nun wkwk Wkwkwk alhamdulillah nun berarti km udh beradaptasi sama bercandaan grup whatsapp Bercandaan grup whatsapp keluarga Kok jd inget kayak anak kecil yg malemnya tidur di sofa trus,1
781,tapi takut keluar rumah utk belanja kebutuhan dapur atau butuh stok dag jujur aku kalo ngga main twitter jg kayanya gatau kalo kita gaboleh ngomong n word itu trimakasi twitter aku belajar banyak sedih banget taun ini ngga nyuci gelas banyak selamat menyambut hari raya idul fitri semuanya semoga amal ibadah kita diterima dan kita bisa bertemu Ramadhan taun depan EidMubarak hpne ajor yaAllah tidak layak aplot gatau jg sih bakal nonton apa ngga yg penting excited dulu CAN T,3
782,Aku ga bisa liat orang menderita tetep rapi dan mandi walau sholat dirumah tar siangnya juga tidur wkwk sedih lebaran kaya ga lebaran wkwkw suka sedih aja liatnya jadi aku kasihan jadi kebiasaan mata melek banget kebiasaan jam segini sahur kasian banget emang iya aku gapernah ditemenin sih jadi gatau rasanya gimana kok buhung si ya kalo nontonnya ada yang nemenin sih ga akan dipause meski terkantuk kantuk keburu ngantuk aku jadi tidur aja wkwkw aku bukan fakboi aamiin,1
783,Birthday to our favourite triplets Daehan Minguk amp Manse sometimes you just need a friend to snuggle with bri rowe IG angkat kepalamu princess nnti mahkotamu jatuh ku udah mau bobok malah jadi emosi kak gt semenjak coba bikin perencanaan dan catet pengeluaran per bulan scr rutin jdi jrg jajan dan klo mau ngeluarin uang mikir dulu berkali2 kdg bertanya2 ini pelit ga sih mau jajan mikir dulu tapi kdg emg perlu begitu hrs bisa nentuin prioritas krn klo semua,2
784,dirumah tidada kumpul keluarga besar krn physical distancing trus itu baju baru mo di ksh liat sapaa tanaman di rmh sarkas garis keras mau mmg dipake kemanaaaaaa prof baju baruko kaukahh HAHAHAHHAA bgmn kabar pemerintah mengusung relaksasi psbb ndatau deh ibu bapak psbb saja masih banyak yg langgar knp tetiba mau relaksasi wkwk kah top ji sma gd kutau nama anggota bigbang weee baru ditau blg nikan inimi dibilang top kah atau bedai lagi wkwk plot twist bingbing gahahha jauhmu,4
785,enjayy Makanya kita sering denger ttg miracle of sedekah ya karena seperti itu Kita kasih 100 dan gak lama Allah kasih 300 Semua kalau kita ikhlas insyaAllah akan mendapatkan yang terbaik Trus kalau kalian ditraktir atau dapet rezeki dari seseorang udah terima aja doain orang itu biar selalu dilancarkan segala urusannya Kadang orang kasih rezeki bukan ingin dipuji tapi ingin didoakan Kalian tau gak sih kenapa kalau kita sedekah itu justru menambah rezeki kita dan bukan mengurangi rezeki kita Simplenya,2
786,married couple Jadi kangen nge pump Wah makasiih rekomendasinya sama follbacknya,1
787,kaga dikirim2 setannn Teler ceplok Gila gue males banget ya ternyata Pas neneknya buka HP disitu gue udh mulai curiga Sistem Pembagian Kasta Dalam Agama Hindu di Bali a thread lathi versi anak travelling udah kangenn oyy lama gk hangout Bali jogja bandung malang anak anak yang dengerin ini sekarang gedenya tiap malem ga bisa tidur karena overthinking Makin gila ni hape From this To this Siapa orgny Batal puasa pake Satu serper Nahhhh goood Temen sepernerakaan Buku perpus dari,1
788,tua Tiap malem takbiran internet pasti selalu lemot Yak siap akun brengsek pencuri karya Bukan dibawah lagi Tapi sejajar sama AC haha Tipe Bagaimana cara SahabatBahasa mengucapkan selamat lebaran Begini kira kira panduan ucapan selamat Idulfitri yang tepat yaa Make laptop apa kaka Salfok sama ac yg ketutupa Ranjang atasnya Konsepnya gimana seh 8 Bit Spirited Away by CineFix My plans 2020 Gws burger blenger Para manusia super lagi meet n greet di CANDRABHAGAHAHAHAHA MARAKASHSHSHSHS BEKASIHIHIHIHIHI etttt itu lu kata,0
789,hatihatikasar Ga boleh harus bareng2 tauu HHHHHHHHHHHHHHHHHHHA Nanti kita cari lagi yg dom bekasi biar aga rame Halo halo anak dajjal Ayo ktia berteman Kamu doang yg dom bekasi atau ada lagi Fix banget ni kapan kapan harus meet up Waah bisa nih nanti kalau ada event2 kita ketemuu KAMU BEKASI MANAAA KAPAN KAPAN KITA MEET UP AYO Some fun song ideas Aku bekasi niiih kamu dom mana Iya wkwkwk kyaknya kepencet like Tp ga tau dh Musowo rawan banget,1
790,feel stupid for being excited about it ur the worst typ Congrats to as Levels is crowned greatest anthem of all time t co 76Sy3z49nw ni anak kuliahan pd kirim2an hampers duitnya drmnsih i thought we were on the same page Iya jadi kalo mau keluar harus banyak bawaan imagine someone tweeting about you My plans 2020 Ga ada yang ngirimin Ini sedih banget sih Maaf kelemahanku adalah diskon shopee dan sociolla Mau maaf maafan yang salah gak minta maaf,1
791,tiba2 jga alis lu bakal ada lagi Aku masih menunggu minuet Sehat selalu kamuuu gapapa alis lu ilang yg penting sehat teruss Wkwkwk klo ga mie ayam ya bakso pas siangan Itu fungsinya buat apa aja si Kasih tau dong Lawak semua replynya Hmm sungguhku tida teracuni produk wardah Done GIVEAWAY KAMERA ANALOG KE 7 VIVITAR EZ MOTOR BIGVIEW bentar lagi lebaran banyak momen yang harus diabadikan jadi aku mau YA KANGEN TAPI GA MELUK KETIAK YAA Bakal ninggalin kangen,1
