id,tweet,ES
1135,in my mouth clothes on my back and shoe on my feet I m blessed and t her lah orang deadline nya malem lebaran wkwkwkwkwkwkwkwkw Me reading everybody s text from the notifications bar and ignoring it because i am busy doing nothing can t you not remind me of this ooh kirain aku juga dulu doang sih sekarang uda gaperna ohh bener ternyata hehe makasih banyak kak btw ternyata km nontonin chella jg wkwkw aku dulu sempet follow dia,3
1136,plurk dulu deh sabaaaaar tetap kuaatttt hhhhh kan bentar lagi sesi iri dan dengki dimulai sy golongan nga ikut solat ied kak wkwowkwowkwowkwokkw iyaaaa perkara tidor doang apa ga sebenernya kuat tp pala uda panas ini btw happy eid al fitr ya alivan nga bisa tidor mau tidur tapi sadar diri kalo dibangunin pasti marah tapi kalo ga tidur ngantuk tapi kalo tidur sadar diri kalo dibangunin pasti marah tapi kalo ga tidur ngantuk tapi kalo tidur sadar diri kalo,3
1137,lain Pa cara mudah membuat kajian teori dalam penelitian A THREAD Kadang saking banyaknya makan asem garem kehidupan para org tua lupa bahwa anak terbuat dari darah dan daging Punya hati Lalu mengapa kita harus menempatkan diri sendiri sebagai prioritas dalam hubungan Simak artikel berikut t c Mengutamakan diri dalam sebuah hubungan bukanlah bentuk egoisme namun menempatkan kebahagiaanmu sebagai prioritas utam nda terima kasih ya udah ada dan menguatkan gue semoga selalu diberi bahagia ya makasih ya semoga semesta beri,2
1138,karena emang gue keren kenapa harus enggak terima ketika gue memuji diri sendiri toh diri ini berhak menerima pujian entah dari orang lain atau diri sendiri sekarang tiap malem kerjaannya liatin video tiktok sama youtubenya kekeyi wkwkwkwkwkwk Adhiguna sama Sabrina ini siapa sih kok tl isi nya pada ngomongin mereka kok sok tau banget sih jadi orang period day 1 be like ya Allah hidupku gak bisa jauh jauh dari es kopi jgan sok asik kmu bukan temanku heran deh,2
1139,orang Nggak gitu ya gaes Sering banget orang Ada saatnya kamu cape dan harus berhenti sejenak Menghela napas menangis berkeluh kesah itu bukan pertanda enggak ber Seneng tapi syedih itu aku dibawain ini sama sahabat Tapi ketemunya cuma 1 menit karena nurut aturan PSBB Padahal biasanya weekend gini ngumpul sama tmn2 Aku kangen kaliannnn Dari yang curhat di buku harian jadi curhat di medsos Dari yang cuma dibaca sendiri jadi dibaca semua orang Dari yang Di dunia ini ada orang,2
1140,naik nikmatnyaa Astaga astaga Izin save yaa Aamiin Dr dulu suka bgt sm walls strawberry cheesecake Akhirnya ada lagi Tp disini blm ada Ko bisaa Mo bkin aj besok pgi Tbtb pgn cilor wui mmf gapuny Yg mna yh Kl lg gini jd rindu waktu masih punya doi Cape Sedih Pgn solat trs nenangin pikiran tp syg lg halangan Wew Pgn rt 100x Gud Unch unch Untuk diriku Tolong jgn over thinking mulu Bismillah semoga citacita kita tercapai yapp Pdhl,1
1141,transportasi tersebut amp apa saja yg harus dilengkapi Setiap instansi transportasi akan mem filter siapa saja yang akan berangkat jadi gak sembarang asal jalan quotes of this day Kalau ada yang susah kenapa harus gampang email please be kind yaa jangan lemot2 mau kerjaa please Hahaha termasuk gue ya py padahal udah geer duluan wkwk nihh liatt perjuangan mereka gimanaa heran gue kok masih ada orang yang nyepelein pandemi ini bahkan suka ada yg nyinyir kalo kita jaga jarak mereka,2
1142,lebaran gabisaa maaf masih I have no control over what I tweet They come to me in visions and I am just as horrified as you are banyak kecewanya sama ni kartu thankieess hard times Cowok berseragam paling baik ramah dan perhatian itu pokoknya cuman Satpam BCA BlackWidow in theaters November 6 Love and its Lessons Loving a person is the most magical yet saddest thing ever This is the reason why we should love i got a mind full,2
1143,Korban dengan tanda ET yg diperlakuan spesial diceritakan dg sangat mengerikan amp menyedihkan di novel Orang Orang Proyek karya Ahmad Tohari Kaet mari adzan dzuhur onok notif pit Rodok gundah gulana difollow sedulur opo meneh seng taat beragama wah salah cuk ndelok jual beli kamera ndk ig mesen gofut ndk merjosari tpi entuk driver e ng borobudur Choose your fighter Tentu saja Katanya harga mati ngga bisa ditawar Tapi kalau ada yang yaudah deh kalau ngga boleh ditawar kita pisah,3
1144,mau buka puasa pake sirup marjan aja ngga btw mohon maaf lahir bathin temen temen semoga lancar puasanya aamiin Biasanya hari pertama tarawih sudah otw masjid lebih cepat biar kebagian tempat Tapi tahun ini berbeda romadhon sudah tiba tapi terasa seperti biasa saja dan masjid pun sepi Udah ih tapi serba salah karena penasaran kelanjutan nya gimana Dari episode 1 8 kebun binatang keluar semua dari mulutkuu astagfirullah Epsd 2 ini rasanya mau jambak rambut si pelakor wkwk Banyak bcd,3
1145,sih I love the way Johnny Buckland ngebetot gitar Gatau al Apa dong Gapapa pasti ada yg terbaik buatmu Jembatan ampera Emg suka aneh2 dia ke kemaren jagung goreng di celupin jus Jambu w liatnya ga napsu jir Yampun coba diskusi lagi ma ortu Itu saos sama selai coklat stoberi Ga kebayang Bukan tantenya kok Ponakan w dah saklek kali ya Awokwokwok Ke ga lu photo Pen liat ak huntunya Beneran lu ke Emg biasanya susah bgt si buat melek,3
1146,dirimu dan bukan untuk memenuhi ekspektasi mereka yang tak men Let s move on Aku berhak mendapatkan yang sepadan denganku Aku berhak memikirkan diriku sendiri dan menolak memikirka yang udah menikah juga sama aja sih tetep jadi bahan omongan tetangga apalagi kalo setelah menikah enggak punya anak di cap nya mandul dll wkwkwk sedih memilih untuk enggak menikah itu bukan berarti jadi lesbi lho dan ada opsi lain untuk yang enggak mau menikah yaitu living together Kdg saya pikir satu,2
1147,tapi bahasanya birokratis banget khas politisi kami upayakan wkwk jgn terlalu berharap jg ya bisa jadi mundur lagi yg Hdeh kelakuan Atlet canva dipersilahkan pls stop this stupid trend Nitip dong min Wow konspirasi ipebe UGM dan ITS memutuskan ospek dilakukan daring untuk 2020 Rasanya enggak akan ada lagi kakak tingkat sok galak teriak Kalian Al muzammil ra punten RM Padang Sederhana harus dilihat dari huruf yang ada di rumah gadangnya SA berarti masih resep murni dan diur I hate,2
1148,mati udah hampir ilang butuh chakra yg byk buat bangkitin lagi Jd semakin wkt berlalu semakin butuh chakra yg byk jg Sedangkan dia baru dpt waktu nagato mati gak sih itu Bukannya kalo ga salah yang bs bangkitin rin tuh nagato ya Pacar kamu seragam Bisa pakek senjata Percuma kalo gk bisa nyelesaiin kasus ini Sipp tunggu ada duitnya dulu baru gue dm syalalalaalalaaaa xixi Ak Mauuu dng yang cat rambut ituh lg di sby niiie HAHAHAHHA temen tuh ngga,2
1149,need right now Hari ini aku belajar imbuhan dari buku penyuluhan bahasa sederhananya nyaris gila Bahasa kita itu terlalu kompleks gw jd paham kalo overthinking ada karna kita gak care sama diri sendiri dan terlalu maksa batas mampu untuk bisa jadi kay BB aksesoris p4nlandw00 warnanya awet nggak guys Tahan berapa lama one day I m gonna have everything I prayed for I really believe it ada yg pasang foto kak Tp foto lee min ho Kemaren baru sempet nyicipin,2
1150,Kardio jadi penting Kalo tujuan kalian buat Strength kardio nya setelah WT Kalo tujuan kalian Endurance Kardio dulu baru WT dengan konsekuensi pas WT gabisa ngangkat seberat kardio setelah WT Kardio Olahraga yg paling gue benci selama gue nge gym 2 tahun ini mungkin keitung jari berapa kali gue ngelakuin sesi kardio Selama proses cutting pun gue jarang banget ngelakuin cardio apalagi pas bulking gapernah sama sekali 3 bulan pertama gym gue selalu latihan itu setiap hari 5 hari seminggu,3
1151,bikin emosi jiwa gapernah dpt fak Bct bgt anjir tuh laki Keluar jalur asimilasi covid aja gayanya setengah mati bib MESTI TIATI Tenang ae har si fika punya sejuta voucher buat kita wkwkwk MAHAR U HARU MENDUKUNG BERKEMBANGNYA KARIR GUE DONGG AHHHHH Ngalah sm yg muda Ga ga gaaaa gue maybellineeeee MAOOOO Gue ke hyper ngantri kasir sejam belanjanya 15 menit doang Membayangkan Ayooo lanjutkan smp 16 udah brightnessnya 0 dark mode tetep ngerasa keterangan Sama Kenapa sihh Kalo bawang,1
1152,WAIT realize that i love my lipstick shade so much after i decided to put it on my lips again since i never done it for months oh jangan sedih aku jg masih tinggal di pencet sal i feel exposed The movie villain The actual villain im so sorry you didn t like the mask Ingin mudik khawatir di jalan ada pemeriksaan dan takut disuruh putar balik Tenang kini ada situs Mudik Aman untuk cari ja Yekalo tau bahaya ya,3
1153,uk 180x200 harganya 110k Rekomendasi Olshop Brand Sprei Lokal Kualitas Hotel dan Estetik Harga Mulai 80K Super murah tapi bahan adem dan motifnya Yang Dilarang Itu MUDIK Bukan TRANSPORTASINYA Ruwet Mumet JokowiKingOfPrank JokowiKingOfPrank Mas nya Tur Wakakakka biang noo nya dari sini nih Ini nih salahsatu prank nya adilnya milih2 di indonesia mag Ramake zaman skrng Apakah pekerjaan sodara terkait dengan kebijakan pemerinth Ya betul Sering menyu simak ya Acara TV TVRI jaman dulu Asik penuh nilai keragaman dan keberagaman,3
1154,my friend ganti ginjal adalah sebuah cita cita alias keren bingit ngefans bingit you gotta do this with your 4th tag them rn HAHAHAHAHAHAHHAHAHAHAH to be independent and successful YES habis dibilang cantik dia melayang Photoshoot dirumahaja w my sister Inspired by Hotel Transylvania She also does the make up what brisik kamgen diajakin temen temen bukber pdhl aku kristen alpukat diapain aja emang paling best of the best MEREKA BUKAN PETUGAS POLISI kangen bgt fag Belle ft townspeople HAHAHA,2
1155,yg seperti tiada akhir akhirnya eps terakhir doi banyak senyumnyaa doctorromanticteacherkim2 RomanticDoctorKim2 kimsabu AhnHyoSeop,2
1156,kancane terus diomongi anak curut mbi bapake KAMU HARUS NONTON Huhu doakan bisa beragumen dengan baik dan benar Alya dianggep bapake anak curut yen neng tiktok Bismillah lancarkan dan permudahkanlah hari ini,2
1157,10 people followed me and 2 people unfollowed me automatically checked by Alhamdulillah ga pernah Monde jelasss 4 people followed me and 6 people unfollowed me automatically checked by sehat mulu pdhl sbrnya cmn grgr stress kepikiran halhal yg pdhl gaperlu dipikirin Gagitu nder banyak yg cmn purapura ga mikirin pdhl sbrnya dia tu over thinking bgt Ky aku org blgnya aku orgnya gampangan ga suka kepikiran dll pdhl mereka gatau kl aku sgt over thinking orgnya dan bisa sampe,1
1158,one person unfollowed me automatically checked by one person followed me automatically checked by 3 people followed me automatically checked by OK INI PARAH diberitakan di MBC News Korea Berita mengenai sebuah kapal dari China yang membuang jasad jasad anak buah k 2 people followed me automatically checked by one person followed me automatically checked by one person unfollowed me automatically checked by one person followed me automatically checked by Kemaren jualan masker sama handsanit yg merajalela skrg jualan rapid,0
1159,Fizi lo mulutnya udah maap an ini Fizi bentar lagi gabung dr Tirta Cari nasi kuning haruan Killer whale sets fish trap to catch bird Filming on a budget Terusin om Om itu celananya merek levis om yak 10jt guru memang Kalo dirupiahkan brp ini guru Kada gegampangan Brother of the year t co 6PishcEVWL Njeh Pak sami sami Pak Gub Pak Gub Pak ada yg lagi ngelawak di depan rujab Pak tangkab Pak Yap mang Bang ada yg mau,1
1160,when he has problems not to other woman Forgive yourself for what you didn t know pgn puter waktu nyesel senyesel nyeselnya nyesel Jika 2020 adalah sebuah buku kehilangan dirasa pantas menjadi benang merah di dalamnya Seakan akan manusia diminta untu maaci dut iyah Usia segini udah mulai males memulai hubungan yang tidak punya masa depan hari ini bnr bnr gaada tenaga untuk ngelakuin apapun tenaga pikiran emosi semua kekuras dipake untuk minggu kmrn kasih jeda dulu ya untuk diri,3
1161,ttp aja mekdinya tutup Knpsi malah nyari keramaian buat hal gapenting Demi konten Biar Wkwkwk ceker mercon ala anggi dr Ji aku padamu,1
1162,ketemu orang2 yang pulamg dari cbd tadi gw merasa amat solehah soalnya beli galon ke warung pake set mukena sama masker ih masyaAllah ukhti tks ya t co brlltIJGBl yang kaya gini kalo asli seru juga kalo dapet gaksih Bismillah Guys allhamdulilah Aku dapet rezeki THR lumayan besar Mau bagi2 2JT buat 20 orang Kan lumayan bisa buat beli ku HAHHAHAHAHAHHAHA gd akhlak emang u you re included sih dhif cara ngatain terbaru WKWKWKWK nangos cbd mar btw gw lupa,1
1163,creamblushi SUSU KACANG LEBIH CONVENIENT tidur woi gosah coli udh tidur aja AKU SUKA BGT SUSU KACANG ttep brantakan krena yg aku pgang brungku sndiri xixix lgian fanfic intriguing silabus matkul kaga bales dendam sekotak 2 hari ah elah au ah tolol males DI WEBTOONFESS ADA SPOILER ANJINGGGG SEOJUN PUTUS AMA JUKYUNG ANJINGG NGENTOTT BABI BANGSAT hfjsfhshdhdh tp keknya iya bakal cuma kek ifhdchadghs babi ok ka GUA GA BISA DIAREPIN TAPI IYA AYO plis ip gua ningkat plis biar,1
1164,kalo potonya tijel wkwkwk Buaaangsaat wgwgwgwgwg Bimantaraades Ngga seruuu Tak ada salahnya balas membalas dalam kebaikan termasuk balas membalas bingkisan lebaran Daripada balas membalas hujatan Gue ga beli baju lebaran tapi gue di beliin dan itupun di beliinnya via onlen Kalian tuh gatau aja sih sensasinya belanja onlen panik kalo barang nyampenya lama kepikiran mulu barang nyampenya kapan sampe itu resi di cek mulu Cobain deh seru kok Honkai impact mungkin Temen temen ini buku bagus bgt Untuk yang mau,3
1165,udah ah nyerah Ketika perilaku saya tak lagi sama yang harus anda tau hanya satu saya kecewa setiap kali mau curhat sama temen dalem hati selalu ah ngga usah deh nanti malah nambah2in pikiran mereka doang akhirnya Jika kamu runtuh dalam satu kesedihan ingatlah seberapa hebatnya kamu bertahan Berusaha yakin sama diri sendiri bahwa ka Pas ada masalah tuh bawaanya mau diem aja Kaya mikirnya yaudahlah biarin aja biar dijalanin sendiri gaperlu ada yang tau bersama tak menjamin kita tak,4
1166,pelaku krn sring bgt dimarginalkn amp btw w jg curious knp mrk bs gt but to say sorry w ga brni ngejudge ky sender hehe lu liat akun instagram nya leeminho ae not really temen gue ga suka coklat alhasil coklatnya dikasih ke gue dong wkwk bang regen di yt deddy corbuzier aslik sampe sakit perut agreed banyak yang bilang di penjara gini mah udah biasa tbh dengan penyataan ini you guys look like melanggengkan budaya ini perpeloncoan bullying abusive,1
1167,co WNzS5mO338 Makasih banyak Thanks alot Iyaaa Sama udah dari pengumuman ltmpt tadi Lagi linglung juga kayak kita juuu ituuu Aldehid keton alkoksi alkana alkil alkana menangis melihat ini how do they knows God bless them whereas He sees people who are truly study hard Makasih siapapun inii aku gak kenal Karena aku gak tau belajar materi kuantitatif ini dari mana Pengumuman tadi bingung banget Sampek nangis sekejer kejernya Aku makasih bangeeeetttttttttt udah mau baik sama kita Psi nya unair,1
1168,Wkwkwkwk Gini rasanya motret NBA 1995 Mending nongkrong aja yakan Saya ingin bahas beberapa kanal YouTube yang menurut saya bagus Semoga menginspirasi amp semoga dapat mengurangi traffic vlog HAHAHAHAHAHA Nordvpn ham Bangun sahur biar ga ketiduran sahur Daddy daughter time bismillahirahmanirahim INDIHOME NGENTOOOOOOOOOT mama s boy the album by us out this year Anjengg ga ada adab bah Pinkman I feel like I m wasting my life waiting for something Vpn yang bagus untuk nonton netflix apa yaa untuk para,1
1169,Pandemi Covid 19 Berkepanjangan PTN Buka Peluang Bantuan UKT Sedih dan senang bersamaan Resmi Tahun ini STAN tdk membuka penerimaan maba Sahabat Muda pemerintah ada kabar baru terkait pendaftaran sekolah kedinasan tahun 2020 Perhatikan baik baik ya Catat j Jadi beneran stan taun ini kagak ada Yg mau ke FTP sini kumpulll Hai Staners Sehubungan dengan beredarnya surat yang memuat informasi mengenai SPMB PKN STAN 2020 bersama ini kami sampaik URBAN LEGEND amp SEJARAH Salah satu hutan yang cukup sakral,2
1170,bergulat lebih sengit dengan diri sendiri ketimban Ramadhan pertama dalam 4 tahun terakhir yang gaada sahur buka dan taraweh bareng sama temen temen Ternyata Allah lagi ngasih tau kebersamaan itu mahal Brengsekkkk wkwkk kok drama ngono sehhh wkwkwk tidak usah mengeluh itu jerih payahmu nak syukuri saja tampilannya bagus editing template web susah kalo seneng bilang jgn munafik pe wkwk opini yang bagus mahasiswa sekarang kembali selesaikan skripsimu sudah tidak ragu lagi naga karena saya dragonbayu hahahahaha kalo begitu ketuker,2
1171,mama hot mama this bummer bummer bummer sent me i really don t know what any of us would do without how are they not sisters i ll never know In bed watching Anchorman for the millionth time she said I m gonna give the lesbians everything they want they re sister irl and you cant tell me otherwise the way christina applegate amp jennifer aniston could literally be twins i PLEASE CHRISTINA amp REESE amp JEN REUNION MAKE IT,2
1172,cousins tapi gue masih bingung gimana caranya ngadepin orang yang mengaku salah dan meminta maaf tapi masih melanjutkan apa yang dia sebut sebagai kesalahannya itu sambil berlindung di balik dalih yang penting sudah minta maaf lama lama jadi merasa tidak dihargai saya nya Arkeolog kerjanya ngapain Kadang bingung sama orang orang di sekitar gue yang mikir umur 20 itu udah tua Gua malah mikir ini justru masih awal dari berbagai tantangan hidup di masa depan Suka kesel kalo udah denger,0
1173,inget dulu fanbase kalo bikin giveaway tuh ada kuisnya dulu kumpul poin wkwkwk sekarangmah modal doang Yes indeed Kalo pengen jadi dokter White people literally turned Bali into one of the trashiest places on earth lol Parcel 50k Hampers 500k That marketing trick is Monggo masnyaaa Punya pengalaman susah nasehatin orang Mungkin ini bisa menjawab A thread Jadi inget podcast nya bareng Kzllll Her silhouette is so remarkable you can tell it s her just from behind Scary Its really,1
1174,you seem down i saw your tweets what s wrong it s okay i feel you don t feel sad because you won t k tired of saying i m okay when i m not Ada saatnya kamu cape dan harus berhenti sejenak Menghela napas menangis berkeluh kesah itu bukan pertanda enggak ber Buset itu kaki kapalan woe YA ALLAH NGAKAK Nah tak taulah aku paling ujung ujungnya lateresp dan ignore dia lagi ehehehe EH KITA KAN SERING NGOMONGIN HAL,2
1175,bang wkwkwk semester depan gtw dehhhh hmm dokumennya via watsup aja memang begini caranya biar fakultas kita terkenal ya debut dulu kak OHH SHiiiT wkwk here we go again gini amaatt iduuup wkwk gw kuliah serius gaperna ada transparansi dana yg jelas ampe semester depan masi bayar full becanda bgt si duit gw buat apaAnnn ada apasi dgn uenje ampun bangggg saur2 udh emosi wkwk ohh emg unj ditakdirkan buat punya rektor yg ky gini2 ya blg gidu akun ini,4
1176,Ga gitu juga kalii Ngasih bantuan kok pake yg haram sih Yg lagi hits sekarang aja min Gue juga gatau sih drakor apaan yg lagi hits wkwkwk Bisa kenal org yg nusuk dr belakang Participant needed Halo teman teman Saya mahasiswi S2 psikologi perkembangan UI saat ini sedang melakukan peneliti Gue pernah nangis depan kaca trus pas nangis gue liat muka gue sendiri tuh jijik trus gue mikir ngapain sih nangis depan kaca eh malah gajadi nangis wkw Ini lebih,3
1177,bener panggung sandiwara Asik parah wkwk Orang yg ga menghargai kebaikan org lain is the worst Fuck u Anime fight scenes be like Memang super sodara wildan ini wkwk Cuma lu doang wil solusi masalah hidup pake indomie Pusing pusing pusing Di dunia ini ada orang orang yang fungsi keberadaannya hanyalah sebagai contoh untuk jangan ditiru Bersyukurlah punya pasangan yang mau ngasih tahu dan ingetin kalau kamu salah terus bantuin kamu cari cara untuk memperbaiki kesa Mohon bantuannya untuk dishare,2
1178,juga bisa harga per Wes kgn wae mantap sekali km sa Gatau sih aku itu makanan lama ato nggak Dulu waktu pas masih jualin mereka aku cobain rasanya b aja Trs iseng bandingin sama yg kemasan biasa yg rencengan gt emg beda rasanya wkwkw Setelah tau itu aku ga jual lagi takut dpt komplen wkwkwk Jingan bgt Ice mochi kan ak jdi ny gra2 km zzzzz Koe sing memperburuk keadaan Koe mudeng aku pie Dengan koe blokir aku ojo ngarep,2
1179,ketauan,2
1180,di langit sana Tuhanku ada padamu ada padaku Ada Suatu saat guru sejarah gua tanya ke temen gua yang orang Hindu Bali ini Dia tanya Bapak bingung Kan di Pancas Cok opo iki wkwkwkw Bacigor e prei sam Nak umi mau ingatkan ibuku membuka obrolan Apa tuh low leh taw candaku Umi kan udah sakit2an segera lah membuka obro cok aq latian nguncal kertu ngene ki ng tembok malah rusak pojok2 e ketekuk Ketika tangan tak sambut menjabat Soale ora,3
1181,Almarhum Ayah cuma satu kali memukul pake ikat pinggang warna hitam Firasah hati,1
1182,dajjal skrg Bukan karna social distancing tapi emang udah umurnya aja kalo mau lebaran ya biasa aja ngga ribet beli baju baru yauda maap Aku tuh orangnya introvert suka punya perasaan duluan baru mikir Berpacaran lah dengan orang yang pernah patah hati dia lebih paham cara menghargai seseorang gatau ah cape Puisi dari Rangga untuk Rakyat Indonesia beda urusan tp hati tetep stay ya din wkwk masih ada mantankan din ikhlas klo digoshting sama corona pgn upload foto sama pacar,2
1183,ayu bgt nangidd Uwu bgt aaa canteekkk Ak masalahe ng mundak ndeee auto mundak T tapi kowe mending nk mundak laa akuu Menyeaal masak mi jam 1 bengi NONTON SAMPE ABIS PLIS jadi gini brou Kirain sinyal ak smpe mode pswat ternyata emg banyak yg ginii Kirain punya ak yg error Orang yang suka bohong adalah orang yang berpotensial menjadi manipulative person and playing victim,1
1184,mahabesar I hope this unfair feeling will end soon mau marah bgt rasanya gua telponan sm pacar gua aj mls kadang klo lg ga urgent ya mending chatingan atau ketemu langsung gt kerjaan gue disuruh telponin customer sehari 50 orang gaji udh dipotong 20 masa duit pulsa jg ga dpt tega jiakhhhh pacar aku mati fix me too heheiya udh sabar bgt ini mah asli ini mah ga boong Harus bertemu dengan berapa perpisahan lagi sampai akhirnya benar benar bisa,2
1185,collegemenfess Ibu kos gua gini ra Mnunggu lagu baru nadin Mau pulang bgt demi dr dulu sllu gini mlh kadang ga dpt sama sekali keluarga ibu keluarga ayah Coba pake saos Kalo inget hari aksi jadi inget pas mpkmb ngelive ada orang tua yg nyemangatin anaknya lewat chatlive wkwkwkwkwkwkw Gorengnya kaya indomi nder i really wish Sex Education season 3 starts with this Siapa yg lebarannya masih nugas Aku Mmffff HAHAHAHAHAHA gajadi julid Kan udh terverifikasi Tegang amat kaya KRL,2
1186,ingat HariJadiTwitterSaya Yessss Daripada maksain boyong World of Married mending bawa Reply 1988 serial lama udah murah engga bakal ada yg disensor bi Perbanyak doa ini ya guys di 10 malam terakhir Doa yg disunnahkan Rosul utk diulang2 ketika lailatul qadr tapi berhub one person followed me automatically checked by Some Johntography from previous trips of his Stay healthy and happy this weekend Johfam JOHNNY NCT127 temen2 bisa help rt gak kalo ada yg mau donasi silahkan kasian bgt ini,1
1187,wkwkwk Jadi parno kalo yang nganterin orderan makanku adalah salah satu dari mereka anda nitipnyaa telaat yaa pas ana br smpe rumah ente baru ngechat kalo ke muara angke psti gak lupaa beli ini Ada yang memaafkan seterusnya Ada juga yang memaafkan sehari saja Karena enggak semua luka bisa sembuh Ayahku minggu lalu pagi2 mruput vicall bilang kirim paket buat anak2nya tapi nggaboleh dibuka kalo dah nyampe Disuruh Anf iya aku yg numpahin trus kenapa masalah ayo bersihin ada benernya,3
1188,4 terus gulanya di kurangin dikit 400k belum bingung mulainya gmn Udh dpt izin nyebarkan lagi dari sg mbaknya Utk kalian yg di daerah mlg bisa membeli dawet kakek tersebut Tiap hri slalu sm HELP Hello since I lost my job during this pandemic I decided to turn my ideas into some products I will try to You know what is so funny Hanya pria yang menganggap penyetaraan hak adalah sebuah kompet Aku udah gak percaya sifat jelek bisa berubah,2
1189,kesalahan should i do on instagram too bancatt kau hooman gaboleh males jaga kesehatan tidur yg cukup jgn lupa bahagia Tiap masa punya kesan lebih masing2 selebgrams promoting bittersweet by najla Too much jealous can kill you error kali gue bisa kok close dulu coba buka lg abis itu jaringan lo Apa gue doang yg baru nnton eps 1 udh gak tertarik yuk bukber sama aku orang korea pada pake borax keknya dia ada juga di pnj sarrr wkwkwk Nanti,2
1190,HELL ya lu gamain2 dota lg makanya jokesnya itu aja kalo gw jokes dika gangerti kan uu gabakal tray kan bucketlistnya dia udh terpenuhi ngekill bang damar seeeh shooter ternyata seru jwonnn 25 knives 25 winners amp Follow to enter guys bantuin akuu dongg aku mau giveaway video ucapan lebaran 3 foto selfie dengan gaya sesuai request kamu bantu aja sehhhhhhh mantul ok mia tytydnya apa enggak ludes ya This is better than slapping all of them poser lu bete,1
1191,lilaccountz kak Miw aku boleh ikut mutualan jugaa gaa Kak izin gabung ya Terima kasih Kakkk Ak maw buattt ntar kk ak folo ya Ya Allah baik bangetttt smngt Biiii jenabbb sini sini huggg Ya Allah monde teman teman saya bikinkan webservice pencarian kata yang akan mencari di KBBI dan menyandingkan dengan pembahasan uda Kak Miw izin share yaa Ayo maju Harus UNAIR 2020 Sha harus tetep semangat yaaa Jgn smpe nyerahhh Keterbatasan ekonomi tidak membuatku berhenti bermimpi nder masih,1
1192,lo lagi beruntung Ketaker TubiTips how i get what i want alias cekidot law of attraction or call it whatever asal tetap law of attraction lyk n Positive energy will attract positive people Kalau kamu pengen punya pacar yg pinter dan loyal ya be that Read books Tapi ini serius tau Gw udh ngelakuin ini dari SD sampe skrg amp wkt itu gw bru tau kalo ini namany law of attraction Cnth buat yg skrg2 aja ya wktu itu gw,3
