id,tweet,ES
338,sinergis dr kedua belah pihak Gausah nuntut kalo dituntut gamau Masa gua diem Sumpah pondok kacang timur serem anjir Masih rame anjirr Corona berasa gaada anjir di malang pecel lele buka dr pagi malem tp namanya lalapan kalo buat martabak setuju Iya sih wkwkwk absurd gitu nyeritain origin phoenix nya wkwk Iya sih cuma gue takutnya dikecewain sama kayak Dark Phoenix kemaren wkwk yang gue takutin giliran udh rilis taunya wkwk loh ada korban sakit hati juga wkwkwk Secuil gameplay,2
339,txtanakfesbuk Si anying wkwkwkwk Normalisasikan menikah tanpa resepsi Saya nyimak aja gan Anjir masih inget lah Gue juga masih on progress kok wkwk Yg penting konsisten aja bay Sebenernya banyak banget mitos tentang fat loss atau muscle gain Yang gue pengen tekenin banget cuman satu Kita gabisa milih mau ngilangin lemak dibagian mana tubuh kita kecuali dengan sedot lemak Sekian thread hasil gabut gue next thread tentang latihan per muscle group Kalo kalian mau ngelakuin Kardio rutin penempatan sesi latihan,3
340,waktu dan tempat yang mendukung Cukup rindu mendaki Xie xie Bakal gue inget man Gtw wi lagi main mole tiba2 aww Muscle strain tapi skait bgt heran Kaciw man Kayaknya saraf kejepit My condolences to you Anak yang punya warung vibes Heartless Sesenggukan gak fa Kalo itu film mama cake man Tulisannya gak kebaca zal anjinggg ups sorry selamat merayakan bulan puasa zal Hahaha Asal gx lupa bahagia le AKH udah capek bgt denger immi btch immi bis immi btch,3
341,cake floating on the ocean in the sunshine gkk y HAHAHA bisa juga ni anak galau bloon mana liat dia kan akun lu diprivate dia sombong tau hahaha makanya jgn kelayapan Nak buat fluffy pancake terjadi dorayaki tapi tengoklah alahai dorayaki pun hahahhahahaha doraemon pun takde selera nak makan Millenial rasa boomer that light reflection on her glasses reminds me of the eyes of the black silhouette suspects in detective conan korea selatan ini peradabannya maju banget padahal rakyatnya ga,2
342,PlayStation 5 Unreal Engine 5 t co OTG8qyiKiP Gapaham lg wkwkwk Demi menanggulangi dampak pandemi COVID19 Indonesia menerbitkan surat utang negara Besarnya 1 miliar jangka waktu Orang tuamu mungkin pernah berkata Anak bodoh Anak sial Gitu aja ga bisa Kamu ga akan berhasil merendahkan kamu Pak As ad pencet angka 7 ga brun wkkw apakah buku pelajaran moral serta hati nurani tidak terdistribusi ke daerah sana Ketika keadilan disamakan dengan sama maka hancur makna adil itu sendiri SayaPercayaIlmuwan tolong ga,2
343,dia bisa menggunakan influence nya untuk membuka mata kita akan Doyoung nct raa t co kEgtzW8nUk Me rn selamat tinggal bumi Johnny wkwk Biaya UTBK turun lagi gaes jadi 150k Jaehyun Pbub sampe tgl 12 nder masih ada waktu setidaknya Pun10 Jika 15 Ramadhan Jatuh di Hari Jumat Maka akan Terjadi Peristiwa Mengerikan di Muka Bumi an Islamic thread New fact persaingan sbm semakin ketat lurr Tahukah kamu Di Fakultas Ilmu Budaya UGM terdapat sebuah ruangan unik bernama Mandala Majapahit,2
344,Coco Nyiapin duit untk nyari joki Yo Udah biasa selo Aku SI tpi goblok maap yaa Iya nder jdinya kaya gini MANG U KULIAH BHS ASING UDAH BRPA LAMA BANGSAT SOSOAN LUPA BHS INDO NIYA GUA NGASI TAU SELAMA2NYA ORG NGERANTAU DINEGRI ORG GABAKALAN LUPA SMA BAHASA SENDIRI ALIAS PAMER LO BABIK Sma song joong ki aja nder Gua malah turun Ga yakali msuk2 langsung final Ohiya personality difference wkwkw maacih Beda pendapat ceunah hye kyo masi ngerasa bsa mandiri,2
345,abis lulus tinggal cari kerjaan beda bidang aja wkwkk Terus pas nanti diserang big mom atau kaidou Luffy bisa counter serangannya dengan daya serang yang sama besar dengan serangan yg diberikan kaidou jd mungkin bisa lumayan damage ke kaidou Just IMO wkwkk Kalo ini dia nahan serangannya terus bisa nyalurin ke tangannya untuk nyerang balik Mungkin kalo pernah liat kungfu panda yg mantulin serangan tailung Nah ini dia jg bsa karena dia karet Shit Mau tidur tetiba kepikiran ttg kekuatan,2
346,lhayoo muangkel aku sumpah kok ada ya suami yg nyalahin istri kalau anak yg lahir gendernya tidak sesuai yg diharapkan saluuuuttt pas nang ibuk sing omah e cedek pak kasun ikulo beb kampret a hoe dangdingdungdeeeer kirain duit yaampun ngakak okey makasi loh kue kacang enak pol pas nde kkn halal bihalal aku ngesak sampe akhire digawani ga bikin makin minyakan kan Dari aku kecil sampai kini lebaran selalu jadi waktu yang dinanti oleh kami untuk wajib kumpul main musik,4
347,ketika lagi ngerasa down dan nahan sesuatu terlalu lama di peluk sam Foldaway mirror cermin makeup led Cute bangett Mencoba puasa ig tapi ngga mau puasa twitter POERNOMO FiersaBesari apa kalian siap bikin konten kita ber 3 menjulid Us 3 VS Dunia maya Wkwkwkwkwk Pikachu buset dhh kirain bokap gua abis nangkepin begal gataunya Formal Virtual Discussion by MoFA with IDN Ambassadors via Zoom Any Ambassadors Amb of Japan KUMPULAN VIDEO FADLAN HOLAO A thread udah cukup clear ngga mau,1
348,Rakha the best penggesek lantai Gila kabur hafizh anjir gue yang udah gak sama sekaliii Dope bgt y kk Perut saya amburadul mas rakha kalo perut saya seperti itu sehari hari saya akan telanjang dada selain ketika beribadah Peringatan dini Ini dia bantuan yang aku tunggu terima kasih mas arya Awas slur damagenya pedih langsung knock gue Jadi lebih susah Pertama kali kelewat sahur akhirnya Lebih baik aku yang mati asal kau bahagia Kajur rungic Ingat xanax Ketika kamu kurang,4
349,WKWKWKW pdhl udah siap siap patungan ga sih APAAN LAGI NIH Bukan kamu ya Awal awal manis bgt itu anak astagaaa skrg absurd wkwk Atau ngga deactive account wkwk Mungkin kepencet mz Kan suda ku kate yg berlebihan memang tak baik Camtu 1 Before entering a relationship we have to make sure we stand on the same ground with our soon to be partner amp that we are committed to each other to work on the relationship 2 Working relationship,1
350,sisa keugman bahkan almet aja hilang entah kemana wkwk Semoga selalu menjadi tempat pulang Selamat ulang tahun rumah HMTG FT UGM Masih ingat dulu kemana mana bangga banget bawa jakun walaupun warna udah kusam amp banyak bercak kotor dimana mana Bonus foto mapping ala2 di Tangkuban Perahu yang udah kedinginan karena hujan ngga bawa mantol Gesagesusesusasa Ampun toke Ini penting banget ya Menyampaikan salam mengenalkan diri meminta maaf akan menganggu waktunya Apalagi sama org penting ya usahain buat selalu mengenalkan,2
351,jejak perselingkuhan ada bekasnya di hati hati dealer new bersih hope Emang enak di dalam oto terus seperti dalam penjara hati lihatpemandangandalamoto otostress bapacul itu enak Alhamdulillah Sedih aq belajar seperti wanita tiap hari nunggu jemputan hati cumadalamoto petunjuk pintusorongan masukongisididalam orang minibushotel Alhamdulillah Sedih aq belajar seperti wanita tiap hari nunggu jemputan hati cumadalamoto petunjuk pintusorongan masukongisididalam orang Alhamdulillah Sedih aq belajar seperti wanita tiap hari nunggu jemputan hati cumadalamoto petunjuk pintusorongan Alhamdulillah Sedih aq belajar seperti wanita tiap,1
352,jdi 0 005 1 semua Ndii kok ak tida pahamm Baru baca ini dari ig nya kak intinya jangan pernah berhenti berbuat baik yaa karena orang baik selalu Ak ngakak hyunkkkk,1
353,dahhh sweet bat Sikapnya tu maniss bgt kadang suka tiba tiba ngasi kejutan contohnya pernah dikasi gancii yang imut bgt pas jemput aku di stasiun setelah ldr lama banget menurutku sweet bgt sih Terus pernah beliin sebuket coklat gara gara aku sering rep buket coklat di twitter Suka nyama Cuek aja sih ngga terlalu mikir org mau pakai apa kalau aku udah pusing sama tugas dan urusan sendiri Sama Ganti desain lagi Duren Bodoamat gua dah Mau Aku bisa bantu,2
354,emg suka y sama cewe cewe yg namanya ada manda mandanye jgn gitu becanda aja kurang olahraga atau mungkin metabolisme lo kurang bgs oh makan banyak tapi tetep kurus itulah tanda bahwa hidup gue banyak tekanan ngeselin sama kaya twit mikir vs twit ngasal insecure melihatmu bales 24434 thank u dah 70k ajanih ini gimana caranya iri ngeliat lebaran versi kalian tuh muka u mirip pensil inul minyak kesturi berantem aja sampe mati dah kita gajadi pak corona kalo ke,2
355,paused from washing the dishes just to reply someone s chat That shit s next level bro lushyu banget arnab ukhty cantik bingbing eyo asdjskwtrktjfkfmxqrsn check tolong kerjakan dirimu sendiri TA this where my anger issues stem from apa tidak bisa lebih clumsy dari ini halo min internet saya mati dan indikator LOSnya kedap kedip merah No IDnya 1000232032 btw Mohon bantuannya ya trims salfok btw DI nya bagus my whole mood Molly nama panjangnya Mollianti Markoneng nder you re,4
356,wilayah kekuasaan Setauku yg bahkan sampe skg msh gitu tu di nepal Di india jg ya Konteksnya pada masa itu menstruasi dianggap sbg kutukan bawaan utk perempuan Lg mens itu berarti kotor Bkn cuma gk boleh pake alat makan yg sama bahkan ada tradisi yg gk boleh serumah Di situ Aisyah ingin melawan narasi perempuan yang mentstruasi itu kotor Aisyah mau ngasi tau kalo pengalamannya dg nabi gak kayak gitu nabi tetep mau minum di gelas yg sama ketika Aisyah,2
357,gapercaya lg gw ama cinta2an tai anjing seru sekali indera pengecap manusia lidah indera pengecap selebgram kamera ig stories fak wkwkwkwkwk mangtep dah bund ceo of ngerusak mental anak orang tau ga eksistensi lo ga guna beneran gajadi mau revisian mau nangis aja buyar semua konsentrasi gw buat revisi makalah anjing begini nih alesan gw ga betah bgt di rumah kalo ada bokap keponakan pas lebaran kamu kok gini maaf ini aku yang new normal yah segini doang nih kasitau,4
358,di rumah s Cewe kelakuan ko preman Ewh Tuwiuwiuwit Pegel2 ya rabb Wkwk y Dasar jutek Bakulan kok jutek ky bebek pret Emang ya orang2 pada gatau budaya antri Vaque Grapenah kuliah online sekalinya kuliah mager Sejak kapan kalian tahu bahwa Petani itu singkatan dari Penyangga Tatanan Indonesia Bung Karno 1952 Untung wis mode mute 5 Impian anak pertama pertama Pendidikan Kerjaan Membangun rumah Nikah Punya anak 5 impian anak bungsu JANGAN EGOIS BANGCAD tak ada yang menandingi rasanya menangis,2
359,basro di perempuan tanah jahanam keren sih ok not only warga ciledug yang begini Corona kalah harga dirinya sama santen dan tadi pagi dia beraksi kembali lol yeu kocak ya Allah kasian banget dosen w jadi ternyata nomornya dihack orang gitu ternyata hehehee tapi hackernya tu kaya polos banget gaksih typingannya pas baru liat gw udah suuzon bgt sih asli knapa mulutnya bisa kaya gitu taunya masker nyampe gak sih kado lo buat ipan yang sampe disamperin ke alamat pengirimannua,1
360,egois karena semua orang juga bosen di rumah aja okay BANGET Semua yang dilaksankn secara virtual ini hnaylah semuu sedih SELAMAAAT SETENGAH S ARS Huhu cpt selesai ya koronaku sayang beneran udah gsabat bgt menjalani rutinitas yang lebih gak ketebak 12am in the middle of monotonous quarantine life me start questioning about my life Dan kucing ini lngsung ngambil bantal gue Ckckckck ditinggal ngambil minum doang lu langsung ngincer tempat w Kebangun jam segini anggep aja lg latihan saur ya,3
361,DevaMahenra Serigala terakhir mah sinetron atuh wkwkw Bener jgn di paksain nanti kabur Mau bales takut salah ketik haha Cuma ngasih tau aja sih biar jadi adik yg tau diri wkwkwk Tolong yaa toloong buat lo yg jadi adik apalagi kalo suka nonton drakor atau channel yutub yg isi kontennya berisik banget apalagi kalo nontonnya malem pake hedset pliiz kalo ga volumenya kecilin gituuu belom pada budek kan yaa Buat yg belom pernah kuliah Trus kuliah di luar negri itu,3
362,Laper Lah serius 14 jam Ga Cntik bgt jaraaaa Lg di panggilan lain tau kn hrus apa Mksh dek Ko tngnnya 3 anyink Ak tunggu besekna Tim bangku tengah belakang w mah lo pada kangen study tour ga sih wkwk Ayo yasinin Gue si owh aja Idan diam Sagi ko valid Idan emg gitu Mau dong dpt gipewey kk Kirain lu Terimakasih bro sis btw mau nanya selama covid ini udah ngasih makan nanggung berapa banyak orang Semoga lebih banyak,1
363,Iyaa bener what s your anthem mine is the only exception Subhanallah If i fell the beatles Re 4 walopun grafik ps 2 tp parah dah aslik asik bangeet Sama Adu gua masi re 4 si kalo cerita kalo gameplay 6 asik bgt Tak perlu menjelaskan apalagi menunjukan karna apa yang kulakukan cukup untuk diriku sendiri I love doing this when i was a kid Dont you dare to ruin my rumah Rambut kupak bgt astaga hayuukk fix klo yg,3
364,Taerattanachai THA 3 21 15 1 2 Praveen Jordan has become the FIRST Indonesian to win All England Mixed Doubles titles with two different partners 21 has become the FIRST Danish MS to win the All England in TWENTY YEARS History Last Danish MS to w FINAL MS Chou Tien Chen TPE 1 vs Viktor Axelsen DEN 2 13 21 14 21 JUARAAA VIKTORRR SEJARAH TERCIPTAAA Gelar All INI DILIBURIN BUKAN BUAT PERGI LIBURAN WOI Lucu banget penjelasan Corona untuk,0
365,around the world who are at the forefront of the re Bw Ru lt lt lt lt lt 5 hati putih at Bw Ru lt lt lt lt lt 5 hati putih at Alhamdulillah ngobatin tangan kanan sakitnya malah dimarahin hati sabar tangan menyentuh bukanmuhrim ada setan Alhamdulillah ngobatin tangan kanan sakitnya malah dimarahin hati sabar hati letsgotomarry beautiful Firasah mobil Hammer biru lewat hati hope petunjuk Firasah lihat kepulan semacam asap hati Aq tak suka bila ada oto bekas,1
366,Jangan sekali kali kamu mengira orang yang gugur d Ketika rindu azan magrib t co rrK3ekVLXn Kamu adalah aku 4 hari yang lalu Pasti momo lagi Jika ada informasi nama sekolahnya ya kak agar kami koordinasikan melalui dinas pendidikan setempat Salam Akupun ngga kok saya beli masker murah kok wleeee malah dikasi kasi gratis sama polisi atau sama relawan yg nyumbang AMALAN 1 MENIT YANG DAPAT MENGHAPUS DOSA 100 TAHUN A THREAD Yuk sempatkan Lha bojone due bojo meneh kok,2
367,klo kita terkena siapa yg akan membantu menyembuhkan kalian Duhhh mager bgt bsk udh mulai kerja lg ya ampuun pengen nambah libur aja Syukur alhamdulillah tenaga medis bisa selalu mendapatkan masker bedah Td malem abis kangen2an sama ibu ayah dila Seminggu lg udh mau ramadhan Sedih yg tadinya udh berhayal bisa plg ke ktb atau ga mereka yg ke jkt tapiiiii karna corona ini semuanya cuma tetap hanya hayalan Jarang2 gua kepo ke lu yeek mumpung libur haha Untung saya,3
368,normal dan jg ttg pentingnya tabungan saat pandemi ini terus ada orang ngomel kat Tanyarl Udah tumpah gaes tehnya Reaction gua AKHI2 KNTL Gua lebih appreciate sma cowo yg BO daripada ini makhluk htt Barangkali punya teman yang menikah muda bisa tolong diinfokan perihal penelitian ini saling bantu cm guis boleh kak risol mayonya Pengiriman dari tangerang cawang Yang mau nanya bisa hubungin yang ada di gambar ya atau bis PRICELIST AKUN PREMIUM 100 LEGAL BISA PAKE AKUN KAMU MINTA,2
369,pandemic well RAPED She RAPED him Mau bantu KAMI tim medis Bukan konser pak tapi ikuti saja apa PERATURAN yg semestinya mudik kalian larang tapi band sering dulu Emang sulit debat sm yg prinsipnya kembali ke diri masing2 Masalah kompleks direduksi ke individu Jadi ttg kompetisi be hhh ibu2 gosan emg ga bener udah nder gausah dipikirin biar dosanya mereka sendiri yg kena tiap scene yule ball gw ampe ngulang2 nyariin rambut blonde kemana tenang kamu masi kicil piyik nikmati,3
370,showing up late to all my online classes green satin dress purple gang Tulip field in the Netherlands Brief kami untuk pak Presiden semoga benar benar bisa sampai ke beliau Bantu sundul ya Mohon Segera Karant It s official that s she s gone crazy balenciaga boots i miss u dior monogram tops cream trousers I wanted a special gift for my bf so i customized an AF1 for him with his fave rock bands dior bucket hat,1
371,INILAH CONTOH GABUT TO THE NEXT LEVEL MAU DAPET HADIAH APA Nga papa kadang petir mencari mangsa manusya yg sombong Couple decide to recreate their canceled cruise coronavirus WISUDA ONLEN CUY Bunga nyusul jadi td pas aku lagi jalan jalan gitu disekitar jalan ke bec bandung ngeliat ada bapak bapak ini lg duduk sambil bikin gblk Anf Mornings in Capri Italy Tanyarl rapyourbae kalah Teman teman ada yang mau bantu beli jualan si bapak Singkat cerita hari ini aku ketemu,1
372,dahulu kini cintaku mulai tumbuh pada sosok yang paling ku rindu jika kamu dan aku adalah dua insan yang pernah dihancurkan bisa jadi alasan kita dipersatukan adalah untuk saling menyembuhkan coba lihat ke langit ada sebuah rindu yang ku titip coba lihat ke mataku ada sebuah masa depan yang sedang ku perjuangkan kamu aku ingin bersandar dan bercerita tentang hariku keluh kesahku sampai ku terlelap dan terbangun bahwa semua itu hanyalah semu terlalu banyak berdiksi sampai lupa hari selamat hari,2
373,man mixing an kita udha jelek pun lebih mending dr ini kyknya man Perawat RS Royal Surabaya yang sedang hamil dan kritis karena Corona akhirnya meninggal Perawat bernama Ari Puspita Sari SK Tidak maksud membandingkan tapi lebih sedih montblanc noland Kasus di Indonesia sama sekali tidak melambat Sekarang hanya butuh 8 18 hari u dapat 4K Cases Sebelumnya butuh 10 96 ha Nyesel sedikit gue reply tweet lo man Gara2 bnyk hal viral kyk penutupan mcd rame dan tiket pesawat,3
374,info ni fren Jadi lu masuk panitia ospek cuma untuk cari cewek cantik Tapi yang ngomong pacarnya maba ADA TUH ADA Teman teman ptn ku kenapa semua maen shopee tanam ya Itu ada speed boat sepertinya keren jika ditambah roda Ta ta tapi pak Coba lakuin di motor Vario Niscaya seperti sedang mengangkat pohon kurma beserta unta untanya Pisahin ka jan malah maen twiter Quarantine day 127940 Katanya doi saat besar menjadi orang ini Sumber dari segala sumber tidak jadi,3
375,udah kaya iman sesuai kepercayaan masing masing boleh apresiasi diri sendiri ga sih hari ini Waktu Indonesia bagian tubuh udah lelah sehingga keramaian pikiran mulai menjajah Kurang tidur banyak pikiran Seolah semua mau dikejar Communication is one thing but your tone while communicating is very important ada ngga muka gue yg lebih berfaedah tahun lalu tepat di hari ini aku buat suatu keputusan yg berujung nyakitin diri sendiri gpp olahraga mata sm otak marry a man who runs to God,3
376,aja dia pernah mengecewakanku tapi ternyata tidak sepinter itu salah lagi nanti ga dikasi thr terus gimana cara mainnya Tuh tau makanya ga ada yang mau ngasi thr wkwkw thr juga berpihak ke rangorang yang goodlucking Dimarahin dong masa lebaran malah tidur Selamat idul fitri juga yud Selamat lebaran Ngga lupa sih emang ga pernah dikasitau aja jadinya aku ga tau Kok amnesia akk tibatiba lupa duh lucu banget kucingnyaaaa selamat lebaran yaaa ga ada bukti karena mereka masih imut,1
377,berani melepas demi kebahagiaan diri sendiri Aries kan rapuhhh wuakakakak Kayak pikiran akuh dong masih di masa lalu padahal dia nya udah ngilang Apalagi kalo kemanisan bikin eneg Berbukalah dengan yang pasti karena yg manis kadang janjinya doang tapi ga ngenyangin Bahagia itu tanggung jawab sendiri sendiri Jangan menuntut orang lain untuk membuat diri ini bahagia Karena itu hanya Kenapa atasan selalu merasa benar Padahal kan dia manusia juga Kan lg social distancing Maapin jarang buka nih sekarang ada mainan,2
378,didpn cew itu akting,2
379,gans iya Ada sejumlah imbuhan yang jika dibubuhkan pada kata dasar akan membentuk kata benda 1 pe r 2 pe 3 ke 4 an 5 mana masuknya di base bukan untuk belajar lagi aowkwkw gak ada kerjaan amat yg masukin ke base julid Liat progress orang lain julit Liat nilai to orang lain julit Liat orang lain bisa lebih dari lo julit Apa apa dij Muncul sini siapa masukin ke base julid Mending masukin di base belajar kek edc kek,3
380,mampu melangkah Beneran terjadi di 2020 lebarannya beda thr annya beda ini gausa yaa udah kerja okeee siaap minal aidzin walfaidzin warga twitter awalnya adhiguna bakal nikah sama safarah mereka lamaran awal bulan july 2019 trus nikahnya direncanain september 2019 Ngulet dikit kesampluk kipas angen darleeng gumussshh jadinyaa takbiraaan Saya menangis selamatkansitifadilah PSBB akan diperpanjang jadi PSBBBBBBBBBBBBBB Pembatasan Sosial Berskala Besar Belum Berakhir Bisa Bisa Bulan Berukutnya Bahk Honda beat sudah ada sejak dahulu kala Mbahnya Honda beat nih oakwoakwaok,3
381,WHAT HAPPENED BEB are u okay jam setengah 2 pagi aku icemosi bgt baru melayang tbtb dibangunin kak ini apa 6 huruf bahasa inggris penyesalan kak bahasa inggris burung gagak PADAHAL BISA PAKAI GOOGLE TRANSLATE AJA LO 2 hari ini papaku bangunin aku tengah malam buat ngisi tts kaku bgt idupnya mas semua yang kusentuh rusak aku ga berani megang anak kucing yang baru lahir soalnya badannya kecil mungil dan ringan bgt i m afraid my touch can hurt them,3
382,pfp aku termasuk ngecatfish ga si lol ada yang mau aku rekomenin video twoset ga wkwkwkw fira kamu bisa aja tp itu ga bener scratch that gpp da ga punya bakat gw udh pasrah cuma kek at least rajin kek ato ambisius kek apa kek plis iya dah pusing pengen punya bakat HAHAHAHAHAHAHBAHAHAHAH at this point gua udah ga nangis lagi baca fanfic hanahaki ketebak amat It makes us so happy that you guys enjoy what we enjoyed making bukannya,1
383,siapa mengerjakan kebaikan seberat zarrah niscaya dia akan melihat balasannya Belom kebayang Banyuwangi Tiktok isinya konten iphone lifehack sama photography tips Padahal pengen banyakin konten memasak wkwk di jogetin dong Ket wingi iki muncul terus Garai pengen moleh ae bocah lucknud sc ig emak gelo official Akuakuu Ceker Lapoo ko lamongan muncul terus yoo Sok sieun ningal truk nanjak teh euy Omahku soto lalapan Aamiin Oraa sing lawas sing kudanan Sampun Alhamdulillah Bersyukur banget Laptop di atas motor di luar,1
384,sbnrny untuk menimbulkan efek jera ada banyak cara ga harus ditempu dgn perpeloncoan tq masih melek gini nih mata alhamdulillah back to normality cari kerja yang sesuai passion ataupun yang bikin nyaman itu susah resign atau lanjut itu pilihan saran kalo emang ga kuat lagi silakan resign tapi sebelum itu udah nyari tempat baru untuk bekerja lagi hidup harus realistis karena nyari kerja ga gampang gausah denger omongan lain nder hidup lu harus merdeka dari mulut2 netijen wkwk jadi jomblo,1
385,them to conform and be a good girl who obeys Aries doesn t obey a i made a playlist for you type of relationship gt gt gt my twitter looks like i m single taken depressed in love heart broken a hoe and loyal so please don t think you act I really love doin this to the person I m comfortable with RESEP KETENANGAN HATI Nggak baca berita sensasional Nggak ngikutin orang cari panggung Nggak nge share kebodohan Nggak,1
386,ada waktu semangat yaaa hai nder ini masih buka slot ngga Hai Kak Apa masih buka slot Ya Allah jika Engkau mengetahui bahwa perkara ini diterima UGM baik bagiku dalam urusanku di dunia dan di akhirat atau Twitter Please Do Your Magic Hallo sekarang Al farabi open jasa askquestion Bahasa Arab kls 1 12 dan Agama Islam me Lolos SBM pilihan pertama Lolos SBM pilihan pertama Lolos SBM pilihan pertama Lolos SBM pilihan pertama Lolos SBM pilih CONTOH SOAL UTBK,1
387,masuk 3 PTN terbaik UI ITB UGM dan STAN Oleh karena itu s Aku cadangannya di HI Unmul Kaltim Ettt ganti unname nih Ya Rabb aku jg gini tp gk berani ambil UGM klo UGM beraninya ambil Sosio teman teman saya bikinkan webservice pencarian kata yang akan mencari di KBBI dan menyandingkan dengan pembahasan uda No Jgn mundur Amiin Ponyo ganti univ tujuan ya Punya kakak malah disuruh terobos Unair kenapa kamu ketat bgt HUBUNGAN INTERNASIONAL HUBUNGAN INTERNASIONAL HUBUNGAN INTERNASIONAL,3
388,kurang ajar orang kayak gitu ga bisa kalo di diemin aja nanti tambah ngelunjak mesti ditegasin haaaaa cowo cih orang dungu sok tau segalanya pftttttttttt ayo gue kira gigit lidah bawah oh mherti mau join group vvibu semangattt ayo ayo hyyy pfttttt sampis jeans kaos typingnya bikin pusing anak pemulung palak lo dia lebih kayak kemana kemana anj dari lo KWWKWKWKWKKWKWKWKWKKWKWKWKWKKW Aku mau jelasin Kronologi kejadian hilang nya abang ku karena sebelum nya aku post di tiktok keterangan terbatas oleh,4
389,ini suapin terus egomu besok baru terasa lebaranmu kekurangan keluarga jadi gabisa cm guys wdyt Aku setuju banget sama beliau Baru aja kejadian sm aku Tugasku udah kelar dari kemarin tp satu anak Dari awal emang ldr sih jd ga ngaruh apa masalah kangen annya Cuma rencana doi buat ketempatku jadi ketunda sampe entah kapan sedih bgt Dia ga suka dipanggil nama doang harus ada embel mas dia emang 5 thn lebih tua sih tp tuh suka lupa gt lho,2
390,keluarga hamba yaAllah Dear 2020 no Dear Allah kami tahu ini cobaan terimakasih sudah membuat kami lebihmenghargai waktu menghargai pertemuan Akhir akhir ini harus lebih banyak menyemangati diri sendiri Baru jg td sore gue ngetweet kangen ibu Eh gatau nya barusan ibu wa trs bilang begini auto nangis gueee sefeeling itu ya ibu sama anaknya bu via sm uni masih kuat kerja di rs karna doa dari ibu ayah dila dan orang2 terdekat kita Setahun ga ketemu ga plg jg,3
391,hak dia mungkin itu cara dia buat bahagia Selama itu bukan contoh yang Sok ganteng lu taiiii nder Sama brooo Org kepri atau org riau Mengulas Kisah Ibu Siti Fadilah Supari Mantan Menteri Kesehatan Era Susilo Bambang Yudhoyono yang Pernah Melawan WHO Saa Rasanya sahur bareng pacar gimana ya Sudah di patahkan berkali kali olehnya namun kamu memilih untuk tetap sabar menghadapi sikapnya Kamu hebat Muda mudahan masih bisa bertemu bulan puasa tahun depan Ayuk Faedah nya apa cb gt,2
392,saja nya glen fredly sih parah langsung nangis tll bgt ketiduran jam 8 malah kebangun jam segini kenapa gak pagi aja si kakak 1 1997 aku 1998 yuhuuu kelamaan mikir voucher disc nya abis anj sebel solusi saat datang yaAllah gw sampe mimpiin unclebrew coba woi ngakak bgt tolong ini apa jgn aneh2 Bandara internasional Soekarno Hatta terbuka Terima 597 penumpang 11 positif Sejujurnya saya lagi bingung mau ngomong ap boleh kak EMOSI BGT IH cowo kampret buat siapapun yang,2
